{
  "specVersion": "0.1.0",
  "generatedAt": "2026-02-01T10:00:00Z",
  "sources": ["https://github.com/example/repo"],
  "releases": [
    {
      "id": 12345,
      "repoPath": "example/repo",
      "repoOwner": "example",
      "repoName": "repo",
      "type": "release",
      "tagName": "v1.0.0",
      "name": "Version 1.0.0",
      "body": "## Changes\n- Initial release\n- Feature A added",
      "publishedAt": "2026-02-01T10:00:00Z",
      "createdAt": "2026-02-01T09:00:00Z",
      "draft": false,
      "prerelease": false,
      "urls": {
        "githubRelease": "https://github.com/example/repo/releases/tag/v1.0.0"
      },
      "author": {
        "login": "developer",
        "avatarUrl": "https://avatars.githubusercontent.com/u/1"
      }
    },
    {
      "id": 12344,
      "repoPath": "example/repo",
      "repoOwner": "example",
      "repoName": "repo",
      "type": "release",
      "tagName": "v0.9.0",
      "name": "Version 0.9.0 - Beta",
      "body": "## Beta Release\n- Pre-release for testing",
      "publishedAt": "2026-01-15T10:00:00Z",
      "createdAt": "2026-01-15T09:00:00Z",
      "draft": false,
      "prerelease": true,
      "urls": {
        "githubRelease": "https://github.com/example/repo/releases/tag/v0.9.0"
      },
      "author": {
        "login": "developer",
        "avatarUrl": "https://avatars.githubusercontent.com/u/1"
      }
    }
  ],
  "stats": {
    "totalReleases": 2,
    "totalRepos": 1,
    "releasesByMonth": {
      "2026-02": 1,
      "2026-01": 1
    },
    "releasesByRepo": {
      "example/repo": 2
    }
  }
}
